nome,senha,mensagem
Isaque da Paz,t#+*8Botk+,Dolorum eius doloremque reiciendis maiores.
Manuella da Conceição,)Z9m@IUijn,Maiores odio nisi non. Impedit sequi eius.
Erick Porto,nR+9Y2Vp^Q,Culpa voluptatem sint quos omnis iure.
Diego da Cruz,Qc2F^9Z77@,Earum fuga molestias cupiditate nemo nulla.
Ana Carolina Pires,o4j%Zu7+(N,Animi eaque nihil excepturi eligendi alias.
Vitor Gabriel da Paz,9P*7yyRe+t,Adipisci perferendis ipsam nulla delectus.
Isadora Rodrigues,&2hB7*5hU@,A vitae voluptate.
Rhavi da Rosa,8ElC%c$Z^9,Sunt qui quod iste expedita hic placeat.
Stephany Ramos,&Cl8Ul9c81,Aut cum quia voluptatibus.
Helena Sales,$5FlNHo373,Vel non dicta dolore.
Srta. Maria Cecília Nascimento,*b3uqPmxa+,Eos veniam quibusdam cumque maxime numquam.
Dr. Murilo Pastor,n4Glj!aK($,Facilis minus ducimus molestiae molestiae.
Kevin Oliveira,$CgGKijt7I,Nam eaque odit. Nemo quod fugit qui molestias.
Joaquim Fonseca,10N5BQhs_&,Ab tempore ab quas.
Felipe Duarte,3y6shArXs#,Nihil exercitationem repellat debitis magnam.
Arthur Gabriel Moura,8B4n*3Ps_@,Nemo commodi praesentium quas odit cumque.
Maria Fernanda da Paz,V0CPK7Xg%7,Saepe repellat nisi exercitationem omnis.
Ryan da Costa,$3jIRRjawE,Necessitatibus asperiores maiores.
Vitória Cardoso,3mNnz(ng&%,Hic necessitatibus earum doloremque ipsum fuga.
Liz Oliveira,)ntBvxKcH1,Tenetur enim sed quod eligendi.
Stella Araújo,@3FX8FoWM6,Debitis voluptas nulla error.
Sr. Bruno Freitas,JaEcfTbg*4,Ea doloribus facilis illum.
Sarah Casa Grande,&3EjUd7H&m,Delectus tempore cumque deserunt quia illo.
Ravi Lucca Sampaio,_RLnntXhi5,Eligendi iusto labore explicabo neque.
Helena das Neves,xl+1Pb#L^Q,Sapiente atque enim ullam natus.
Emanuella Duarte,_I0duQhMYF,Quisquam natus a nisi est quae numquam esse.
Vitor Hugo Caldeira,H&50*USw!Y,Et maiores sed sapiente.
Sr. Enzo Ribeiro,GN7s@rWiB(,Nemo assumenda architecto aliquam fuga sequi.
Eduardo Rocha,l4g+7DBf@&,Nostrum sint accusantium at.
Valentim Viana,Tb1tWzpy_w,In iure nihil non nisi exercitationem laboriosam.
Emanuella da Cruz,ZGV6Ev6id#,Accusantium magni exercitationem blanditiis.
Alana da Luz,S!V1F6djtD,Culpa tenetur distinctio enim.
Anthony Gabriel Cirino,wN4gGesNw#,Asperiores eaque molestias qui.
Brenda Almeida,+Oh@0Qxn8R,Libero cum accusamus asperiores enim quisquam.
Matheus Garcia,7&6DrcAahn,Ipsam tempore eius perspiciatis beatae sint.
Maria Moreira,^f$NH#bo7*,Ex esse magnam. Dolores voluptatem eveniet ex.
Rael Moura,f*6wsaUivk,Saepe placeat nihil aperiam libero beatae ab.
Vinícius Pimenta,uKG1NYJi!Z,Laborum eum autem ad animi pariatur nihil.
Samuel Cassiano,u_O*5zK#cg,Natus dicta facilis pariatur reiciendis.
Mathias Moreira,I!3(5WQl^!,Natus veritatis deserunt ducimus.
Nicolas Gomes,zJA+4Sgh8F,Harum sed fugit.
Aurora Campos,PB3&0ZNj^E,Sint laboriosam eos voluptas illum repellendus.
Luara Silva,&bB+uii+@8,Impedit ducimus fuga repellendus cumque.
Bianca Aparecida,+g5P6vxow3,Illo necessitatibus exercitationem commodi.
João Guilherme das Neves,5en7L4AvR%,Quam eveniet facilis.
Dra. Rafaela Marques,)62^CLrvmB,Perferendis ea sint magnam hic non.
Sara Albuquerque,a6MeynBc*_,Doloribus eos eveniet rem sequi.
Emilly da Cunha,rY92Dlwm0$,Nisi et pariatur neque esse.
Cauã Castro,Q#$zUxk#$4,Recusandae illo natus culpa rem ipsam dolor quis.
Lavínia Pinto,HiCAU9j8%2,Id suscipit magnam.
Dra. Manuella Costa,)qMHf$sW&7,Vero dolore cum eum officiis.
Sra. Larissa Martins,%e^4I5Pker,Eaque nesciunt laborum minima possimus esse.
Sra. Sofia da Mota,#E19jMtA^c,Unde dolores repellat error quis fugit.
Rodrigo da Luz,!AOw4FJl^%,At suscipit tempora. Enim itaque atque amet enim.
Joaquim Rodrigues,Ur6z6Toi$m,Optio repudiandae rem fuga.
Sra. Bella Martins,91xBEf!l@#,Enim quae necessitatibus a cum quod officia.
Dr. Thales Souza,+lu&sXjbF5,Culpa impedit quos excepturi labore nam.
Alexandre Ferreira,fkYsisiG#9,Itaque ea occaecati occaecati.
Ayla Cirino,!YKtAB6o_4,Facere fuga minima deserunt.
Davi Luiz da Mata,4CV@0nQd6j,Exercitationem molestiae tempora.
Sr. Cauã Garcia,sMrQUv7i$7,Voluptatum accusantium quae.
Zoe Pires,1a%W7ZPgMC,Rerum quisquam fuga accusamus incidunt possimus.
Sra. Maria Isis Vasconcelos,c^B0Bqs!eY,Minus amet rem aperiam.
Evelyn Santos,E5NMpBkl_I,Eveniet laborum voluptates sequi nihil velit.
Davi Lucca Aparecida,%6ILBtrjVZ,Quaerat reiciendis distinctio.
Enzo Cirino,h+5%Z$czWa,Natus reiciendis quam nihil.
Luiza Jesus,JE1JTYok)2,Libero alias necessitatibus saepe.
Stephany Casa Grande,x_0T)Mh0T_,Suscipit debitis totam harum eos totam.
Lucas Gabriel da Costa,^4DFHnrmPk,Accusantium doloremque tempore.
Benicio Ferreira,!Kte8ANnU5,Rerum aut id. Culpa officia non mollitia.
Sr. Lucca da Conceição,g40kjyCqO*,Cum cum dignissimos aspernatur.
Luísa Araújo,@6HYoYRgqU,Perferendis dolor similique illum ipsam nemo.
Vinicius Fogaça,*35d0HDocd,Eos quia impedit tempora possimus perspiciatis.
Ana Cecília Novais,c0_LfLR5#s,Minima fugiat ad natus laudantium tempore.
Francisco Carvalho,fd003A7m8$,Ipsam nam totam possimus consectetur qui.
Sofia Pimenta,0PFiCBlI+T,Nemo tempora ad sit.
João Felipe Melo,zzx91*Ai)e,Quasi saepe mollitia ipsa atque numquam.
Srta. Elisa Abreu,_7SjQgFG)v,Quaerat est sint.
Srta. Laura Rocha,b6!s6DZyS+,Blanditiis praesentium iusto placeat saepe.
João Vitor Albuquerque,&i6fHjRT(C,Reiciendis beatae ratione. Nemo nisi laudantium.
Paulo Nunes,#uUGqLPlG4,Animi saepe ex minima eveniet.
Yuri Gomes,&NliQ2OkSK,Impedit amet voluptates eligendi provident magni.
João Felipe Cunha,L!9VJa)$(V,Tenetur delectus in dicta repellendus error.
Agatha da Cruz,w*c8@nTtpW,Quia ducimus dignissimos repellat porro maxime.
Isabella Macedo,%519jaVfE^,Facilis quidem commodi necessitatibus.
Asafe Machado,y5nYIClq(7,Dicta similique pariatur deleniti dolorem.
Eduarda Rios,@WS9eVW5H2,Iusto tempore perferendis quibusdam harum.
Dr. Breno Ribeiro,_b26KQhXt4,Nisi tempora dolorum modi.
Dr. Caleb Costela,gMr9PzJpL#,Quaerat veniam modi odit cupiditate assumenda.
Dra. Juliana Silveira,04_cQruC&w,Fugiat earum optio sed beatae natus.
Heloísa Novaes,C+0rMweU(n,Labore suscipit eum reiciendis.
Lucas Fonseca,%6Ug&Cf90c,Repellat suscipit unde qui quibusdam iure.
Sr. Thiago Ferreira,O)1Kvr_ygQ,Repellendus eaque iure perferendis.
Ana Sophia Fonseca,&tnD2gkT5p,Nisi aperiam sint corporis pariatur reiciendis.
Maria Fernanda Duarte,@M_pN0InF1,Ratione iste nulla.
Aylla Nunes,!8JZc6ML*2,Ullam corporis quia culpa debitis culpa quia.
Sr. José Miguel Rezende,atI3SBef*!,Perferendis voluptatum accusantium quasi quos.
Sra. Eduarda Ribeiro,_3!&OwGpNs,Perspiciatis expedita ea labore.
Eduarda Cirino,125IYIig+$,Totam ab repellendus suscipit.
Anthony Borges,^HV6#*LcnQ,Atque reiciendis consequuntur mollitia laborum.
Alexandre Nogueira,#HU(g#fa3L,Veniam qui culpa enim perferendis fugit.
Leandro da Rosa,+Xj848GowC,Omnis veniam nesciunt dignissimos doloribus esse.
Jade Moura,#i*8&LmbN!,Quidem blanditiis nostrum laudantium numquam.
Diogo da Cruz,p(iY5OhmrI,Nulla labore nulla.
Sr. Ravi Rezende,t#38AIw8jU,Rem nisi dignissimos temporibus praesentium.
Joaquim Barros,0T0DvAj_^z,Possimus quia vero asperiores.
Agatha Viana,zy4KSd8O$@,Recusandae aut molestiae quos.
Jade Caldeira,%O%8LHxsrt,Ducimus minus nostrum enim quo debitis.
Sr. Gustavo Henrique Siqueira,)5KxUEv%f2,Facilis fugiat repudiandae.
Dr. Lucas Gabriel Barros,+FqH6MGcxP,Libero odio quisquam excepturi.
Mathias Andrade,!)2DtjuR)9,Fuga numquam recusandae debitis sunt facere.
Sofia Garcia,G*W4Rqy#M_,Quo praesentium pariatur animi alias architecto.
João Gabriel Pinto,FK7ufQskU@,Architecto quia quibusdam.
Eloá Sales,B@8eH46a5T,Dolore repellat cum atque.
Maysa Ramos,i19NIpdUb*,Magni cum tenetur.
Isaque Camargo,FnCm0KSo&0,Quaerat aut autem doloribus commodi.
Maria Luísa Garcia,3IIQuE4b*E,Nemo aut quidem aut reprehenderit.
Luiz Miguel Castro,8*2!LpKjpk,Natus ullam voluptatum quisquam.
Sr. Kaique Guerra,MmrAJAo*+2,Sed numquam totam ipsam beatae.
Renan Porto,5d!E1APn+7,Voluptates fugiat sunt sit quibusdam corrupti a.
Gabriel Fonseca,_X0HDsjfw2,Illum voluptates tempore eaque nobis.
Lorena Fogaça,3J@qbkxX$e,Quod distinctio molestias aperiam.
Ana Sophia Moreira,V$dm_7NaNw,Voluptas ratione sint pariatur eaque sint.
Murilo Novais,4s9W+FOnf#,Culpa perspiciatis molestias ullam.
Theo Abreu,H)5FnONsK_,Maxime vero ab mollitia.
Dr. Arthur Vieira,O@R8QIgA+o,Ea quae expedita.
Dr. Pietro Mendes,2*857YzrEj,Velit debitis doloremque dolore.
Léo Oliveira,#@c0Yhbk9&,Consectetur animi exercitationem id optio.
Sr. João Felipe Duarte,$5TM*dY0+c,Nam asperiores aperiam recusandae.
Dra. Carolina Correia,jW3OCdse_1,Sed facilis sapiente necessitatibus.
José Fogaça,^8eA+bqLJk,Temporibus natus animi omnis saepe.
Leandro da Conceição,M!9q5Zz8&r,Vel quas deserunt ex.
Sophie das Neves,*8lHkfi0OS,Culpa qui ipsam harum error enim porro repellat.
Alexandre Melo,$rYEWsJxy1,Sed doloremque nobis incidunt nihil eius fugiat.
Ana Beatriz Vieira,+HOtkyt+3K,Quos dolores quaerat vero vero.
Rafael Leão,(q27_TpzJo,Nisi rerum quod placeat dolorum maxime.
Isaac Lopes,K@0fJ7Lh2C,Laboriosam esse illo.
Henry Gabriel Guerra,xc3FNr1U_E,Nulla beatae non nam vitae labore quasi repellat.
Théo Costa,jlvLfb3x%1,Excepturi nobis aperiam distinctio ut doloremque.
Júlia Guerra,Y%8CGLncF(,Vitae reiciendis illo perferendis.
Rafaela Silva,56yN^eaq(I,Voluptatibus reprehenderit recusandae optio.
Mariane Peixoto,7&UC4zRx+G,Error placeat expedita fuga.
Maria Alice Guerra,zr3Hm3ekR!,Nulla excepturi quis magnam eos.
João Guilherme Pacheco,qi_S9Qy415,Quam repellendus consequuntur voluptatum harum.
Catarina Mendes,&z0UXflR9a,Neque tempora totam optio. Numquam neque nemo.
Evelyn da Cunha,4*8EkdpavL,Voluptatibus minus consectetur quisquam fugiat.
Zoe Viana,Hd1FAbi%a+,Dicta voluptates delectus tenetur ea perferendis.
Maria Cecília Nunes,H^9dN(KOIe,Non dignissimos quisquam omnis.
Alexia Vieira,W2qMx!v7!+,Consequuntur magni debitis quos blanditiis.
Sr. Arthur Casa Grande,(5NSPW5Qsy,Voluptate porro libero.
Cecília da Costa,pwXM!TDy#2,Dicta sequi minus impedit.
Ravy Martins,@bB4en+fw5,Temporibus ab harum sed non.
Srta. Jade Mendes,b6dq7VCd#F,Inventore non earum architecto iure cum nisi.
Vitor Ribeiro,$4%&#VixD(,Rem rerum error error illo.
Danilo Cavalcanti,IO#5cIvEW*,Aspernatur excepturi asperiores.
Davi Lucca Jesus,*8maASy7*a,In voluptatum eaque magni minus ex.
Fernando Montenegro,#N0lml#vr!,Culpa veniam consequuntur harum.
Enzo Santos,v$7EWjvsdv,Delectus veritatis eos unde.
Rael Gonçalves,#_TbyHg21t,Velit sit vel hic fugiat quo dolor.
Ryan Sousa,izLM5R6ut@,Quis expedita consectetur ea.
Bryan Casa Grande,!kqH@FWe$6,Ea rerum porro officiis nisi aspernatur.
Allana Fonseca,(0zLUX3g(D,Reiciendis placeat minus sapiente corporis.
Rafaela Pacheco,1U4CNWXf_7,Sunt nesciunt provident omnis quos expedita.
Sr. João Felipe Cardoso,(Y%1Nk1AO%,Voluptatibus omnis veniam ipsam labore.
Maria Cecília Fogaça,h3oE8pWk$+,Animi cum doloremque consectetur saepe provident.
Evelyn Gomes,qN5f8AeqO&,Inventore quia nesciunt fugit hic minima alias.
Maria Cecília Freitas,(wB)PIyPa6,Possimus iure explicabo ut corporis sint.
Thomas Pacheco,&oy2ZymIz+,Maxime explicabo impedit ab dignissimos aperiam.
Maria Sophia Vargas,JDQZVbio*8,Reprehenderit tempore repellat esse.
Ana Lívia da Rosa,p&8LjgE_j!,Placeat in porro impedit.
Rafaela Cardoso,0P8aFj5h#&,Voluptatem ad deleniti sapiente molestiae vel.
Beatriz Freitas,+1Awj0PvIp,Nemo accusamus sapiente cum.
Maria Laura Costela,!_@15oXdnl,Molestias quidem tempora inventore aut aperiam.
Miguel Ramos,hbS4KqbSl@,Quibusdam quibusdam et distinctio vero.
Rael Novaes,a!EW53EgU7,Similique quos illum ratione.
Luiz Henrique Borges,Wl%5VsTgUy,Quos nisi dolor incidunt dolores enim.
Antony Pereira,9uk8KgLh)M,Nam eveniet veniam minima repellendus sunt.
José Miguel Marques,$5%wDy972m,Mollitia velit quasi quos a voluptatibus.
Srta. Eloá Ribeiro,$knYhAwI$6,Dolor debitis at eos dolor ea dignissimos.
Maria Costela,z0BtwW6&+5,Libero aliquam qui voluptate sunt fugit.
Augusto Rodrigues,l8#YtljX!_,Quas cum porro laudantium veritatis.
Arthur Gabriel Siqueira,)_5NwL+jeU,Eum ullam labore cupiditate nihil dolorum.
Maria Luiza Marques,RQPJXmfD#9,Sed voluptate placeat.
Henry Teixeira,$NRR453jd3,Dicta dolor itaque sunt.
Davi Miguel da Rosa,)uUe1r@hH0,Tempore earum quis ipsum unde.
João Felipe Melo,P6*@6LYz^c,Nihil cumque odit ad mollitia temporibus facilis.
Heloisa Pereira,)pIuGnWk8Y,Deleniti vel culpa. Reprehenderit adipisci in.
Maria Helena Pimenta,_MzV5#Uy6m,Sit tempore alias in quia repellendus doloribus.
Liam Pastor,pj6nD636@7,Magni rerum iusto perferendis qui.
Dr. Thales Ferreira,2lSUg0RCn+,Odit esse ullam enim aperiam.
Maria Laura Rocha,uUS85(3b)*,Quaerat soluta consectetur.
Sabrina Farias,CG*4WZriP%,Sit cupiditate reiciendis eaque nihil.
Dr. Felipe Duarte,!wfYir@b4w,Nemo a voluptatibus vero odio occaecati nam.
Stephany Vasconcelos,Q_0DHFoQl6,Vel suscipit voluptates provident laudantium.
Guilherme da Cruz,F(X7N#v8P+,At consequatur ratione ducimus qui alias.
Maria Liz Monteiro,!*ccZ9Hk1D,Maiores ipsum qui provident.
Clara Campos,BqN2&3Fcv),Ipsam ipsa voluptas enim quasi.
Ana Júlia Rocha,vd*8NkdYKn,Dolorum accusamus perspiciatis nihil.
Aurora Fogaça,!w7pvDqZWS,Enim vitae corporis quod ab.
Emanuelly Vasconcelos,L5H2k^Sx&R,Laborum optio in ipsum pariatur.
Nathan da Mota,@7JMu#eN@2,Nam facere eos dicta perspiciatis ipsa amet.
Ana Luiza Pires,3g#13OGfQ!,Ullam placeat ullam. Dolor et ex eius.
Pedro Miguel Nogueira,nu0CP(aV!A,Aliquam neque sit natus.
João Guilherme Andrade,iYG2Jngmu(,Repellat omnis nisi eligendi.
Rafael Silveira,D_okV9Le0&,Quo hic eos excepturi quo.
Benício Aparecida,G!4Ykx(8*D,Porro aliquam eum earum eligendi nihil sit.
Dra. Maya Cavalcanti,$8AAOxux7p,Doloribus odio ab quos. Autem ipsum ea ipsum.
Nina da Cruz,%JE%8oXJf8,Beatae laudantium aspernatur suscipit velit.
Vitor Hugo Almeida,#D1x3T%lp@,Unde quos corrupti ad.
Nicolas Brito,_KJJRQKlc6,Enim perspiciatis dolores facilis pariatur.
Luiz Miguel Fogaça,Zvq0P%+m@q,Placeat accusantium sint eligendi.
Eduardo Rocha,tav8prWN&0,Quo porro enim tenetur ratione.
Vitor da Paz,dm3LafVd@U,Quos a velit totam consequatur cumque doloremque.
Srta. Maria Garcia,O3UTNuJm!L,Aliquid earum sequi quasi.
Lucas Vargas,)D9sEqNr(Z,Quo eligendi suscipit reiciendis.
Dr. André Cavalcanti,m&7AzXw3CC,Cumque eos soluta culpa sint.
Mateus Machado,US4s+P)f(5,Harum sit sed cum similique adipisci ex.
Dra. Ana Clara Borges,&0t*HasOH^,Illum unde iusto blanditiis.
Maria Júlia da Mota,K+I%e2Es#8,Amet laboriosam mollitia.
Pedro Câmara,R8UGfof0^1,Dolorum animi odit eos impedit iste sunt ad.
Alice da Paz,x^n$AUVzZ1,Autem placeat dignissimos dolores ex.
Sr. Joaquim da Luz,M$3UWwrE6!,Eum minus molestiae similique soluta natus nulla.
Nicolas Duarte,01DU0ZzqR%,Eos facilis sunt ex officia.
Dr. Emanuel Sampaio,1KB_*+@o!q,Fugiat eveniet amet veniam nesciunt enim.
Alícia Fonseca,9$p3jQrFh3,Dolorum dolorem vel asperiores quae sit.
Luana Albuquerque,$1#zV&4kC3,Quasi itaque repellendus atque.
Enrico Moura,G15HdXCZ+h,Quidem amet dolores dolorem itaque enim.
Gustavo Almeida,$6SPci)I$7,Aperiam necessitatibus eaque esse repudiandae.
Francisco Pereira,P9TT)AQt!r,Quis veniam corrupti nemo ratione.
Maria Luiza Vieira,kLk5+3JzT^,Laborum nostrum quibusdam cumque a temporibus.
Lorenzo Campos,*OV61xbcj2,Mollitia numquam ea ducimus aliquid iste.
Juliana Cavalcanti,S@6ET^9whO,Non beatae incidunt voluptatem.
Dra. Daniela Vargas,$)8&WQtG2N,Quidem minima deserunt cumque fuga error fugiat.
Dra. Lorena Rodrigues,cz*3m+Mw#O,Blanditiis aperiam ipsam est quidem ratione.
Rhavi Oliveira,x6gKDuuf@#,Aperiam placeat doloribus sit.
Sra. Mariana Garcia,!S26EQBeu+,Quis voluptatibus aspernatur velit qui.
Valentim Ferreira,%5MmQGw)+N,Impedit placeat nemo omnis nobis.
Yuri Ramos,f3yORK71$4,Magnam ea voluptatibus ipsam distinctio neque.
Matheus Pires,208P$rLb!d,Voluptate quidem consectetur in ad.
Giovanna Pimenta,59D6qzgA_G,Beatae deleniti quam dolorem.
Alice Silveira,t6pE$uy&&K,Ipsam ad perspiciatis enim delectus non rerum.
Alícia da Mata,5raJNEJ&*l,Numquam accusamus nostrum quaerat quidem itaque.
Isis Sousa,bQ2YYda1*1,Amet quas deserunt inventore.
Lavínia Leão,jf2TYgcUA&,Porro possimus in quae harum itaque.
Sr. Antônio Pastor,@3Za3JYfC7,Voluptates laborum sed magnam.
Enrico da Cruz,ip^GNH4n)0,Natus rem nesciunt cumque.
Srta. Nina Nunes,+FE%3gSwJ+,Aliquam voluptatem dolores illo fuga soluta.
Dr. João Araújo,!xQ*5Mfxp#,Nesciunt vitae odio provident laborum assumenda.
Dra. Camila Montenegro,56U1VhLq#T,Quia provident minus error et eos reiciendis.
Evelyn Duarte,YP2CKJva!$,Consequatur ducimus quaerat saepe.
João Lucas Sales,X*$kE0GcA9,Suscipit voluptate ratione earum.
Carlos Eduardo Montenegro,jpV*$2Ony),Neque sint incidunt ratione.
Josué das Neves,@86BQEPd_%,Autem sapiente facere officia eligendi.
Henry Gabriel Ferreira,Pg0(RMHuf*,Dolores deleniti eius architecto.
Clara Siqueira,rv5BJfSA+X,Eaque error perferendis beatae.
Theo da Costa,6RI+4yez&5,Dicta quidem vitae quaerat ducimus tempora.
Davi Luiz Barbosa,2Km8CqMh^6,Ipsum exercitationem ex sequi quae.
Diego Sales,37+(6XFpp6,Doloribus consequatur nesciunt nostrum a.
Maria Vitória Santos,2gg5JqSF*U,Non odio unde. Eveniet modi provident.
Dr. Gael Fernandes,^5E34lKb&u,Dignissimos mollitia at dolorum blanditiis.
Eduarda Gomes,(#7%eLtgkN,Explicabo ex ex debitis.
Lucas da Rosa,kh*7FV#q!I,Iure voluptate explicabo commodi deserunt.
Gustavo Garcia,(3SAgvp%&G,At dolorem dolores vitae nulla necessitatibus.
Sara Cunha,N@0kEzSyL),Dolor tempore saepe vel. Ducimus illo nam quam.
Isadora Caldeira,L(6E+kU9*S,Architecto repudiandae accusamus iste.
Zoe Camargo,K4VknS^+@u,Corrupti vitae aut quo.
Otto Nascimento,+9GEUeut%8,Itaque cumque consequatur est excepturi velit.
Sabrina Rodrigues,H49W2ANd$q,Iusto nisi nostrum quasi ducimus iusto voluptate.
Ravi Lucca Vasconcelos,&eg6Dv%jXd,Incidunt possimus iste laudantium.
Sofia Porto,7dWk!l2v^%,Repudiandae iure totam dolore vero nihil natus.
Sr. Murilo da Paz,(^_Omnv5k9,Sed quae adipisci rerum enim.
Natália Alves,9m+KJ%r()w,Iste delectus distinctio maxime in vel.
Josué Alves,&8HieLfpKG,Alias incidunt ipsum aperiam vitae modi.
Davi Lucas Ramos,fsPVbvLk_7,Velit porro dolor impedit est reprehenderit.
Sra. Sarah Aparecida,w8E(1Ti2L@,Eveniet repellendus ex quo tenetur.
Dr. Otávio Gomes,+43apPr(HL,Ipsam aspernatur modi a ad.
João Gabriel Lima,_nJ+QdR@p2,Architecto iusto tenetur velit neque.
Dr. Caleb Brito,#X329Qc*^h,Reprehenderit voluptas dolores alias.
Danilo da Rocha,_8OAK4v8)Y,Impedit iusto temporibus id temporibus tempora.
Luiza Oliveira,Z+3ZemOoFR,Incidunt ducimus error fugit sint eveniet.
Maria Eduarda Cardoso,hiJ@79Hq3_,Laudantium explicabo sint ipsa facilis nihil.
Marcelo Nunes,y#(8gQKi1K,Dolore eos repellendus doloribus corrupti.
Liz Cavalcante,*82QHz2we$,Repudiandae animi ullam ipsam iure a.
Laís Albuquerque,(0pM%ZdQvj,Provident saepe laborum et harum iure.
Vitória Pimenta,5yh2EkQC!b,In itaque quod voluptatem quia corporis.
Igor Ribeiro,wzEK&uKK@5,Consectetur repudiandae iste ipsam.
Ágatha Mendonça,33QcVS^u!f,Nihil tempora deserunt necessitatibus vitae eius.
Yan Ramos,PCj4ipqd^4,Esse unde nam magni expedita odio dolore.
Ester da Rocha,Ea4figOm*$,Aperiam non porro perspiciatis eveniet in optio.
Maria Vitória Pires,551R3YYdK%,Sit officiis corrupti est rerum aut unde.
Ana Carolina Souza,E)i0)TDkbE,Unde repellat accusantium tempore.
Lorenzo Gomes,#zM2OSbxF6,Assumenda illum dolore eos eveniet assumenda.
Vitor Machado,O^n2Xqux*F,Inventore corporis sapiente debitis.
Davi Lucca Abreu,^3*frPRQht,Quisquam necessitatibus modi ad.
Joana Cunha,Gk&RAry(@9,Nemo sed dolor corrupti ea error.
Benicio Novaes,Z_h4fAjT#u,Accusamus facilis dolorum maiores dolorem.
Oliver Novais,QJfGN8neP@,Vero excepturi quia rem.
Sr. Luigi Ramos,GiBpziEP#1,Mollitia cupiditate ipsa quas.
Sra. Bárbara Cunha,h*09Nn7M4V,Alias neque itaque doloribus.
Isis Duarte,wp02Y+o4B*,Neque non totam aliquam rerum unde.
Guilherme da Conceição,b5!(+gvv*Y,Explicabo esse dignissimos minus qui magnam fuga.
Raul Lima,!r4VYhM7j4,Reiciendis sapiente quae alias delectus nesciunt.
Dr. Noah Sampaio,*TILLch$i9,Ullam ex aliquid excepturi corrupti aperiam at.
Allana Marques,_2UDS8aDDP,Tenetur eos facilis magni recusandae.
Dom Sousa,Z5BhiPcx@s,Quos id rem quae quae.
Sra. Ana Cecília Pinto,H+0FfNjO@Q,Tempore amet voluptate vitae.
Cauê Aragão,ZiZwHn_*_7,Repellendus enim fugit error totam incidunt.
Bruno da Costa,@@9o_XrzH8,Reiciendis delectus perspiciatis numquam.
Rael Albuquerque,In4qKHIh##,Et placeat mollitia nihil.
Laura Ribeiro,_dY0W$8Gq6,Hic qui minus ad.
Maria Luísa da Mota,d%rR4Cc(H#,Molestiae qui fuga corporis odit.
Yuri Azevedo,q+8zTMwmb#,Libero quia tempore sunt quod doloremque quam.
Maria Júlia Jesus,)u+0TsWq0_,Rerum minus ex repellat dolor incidunt.
Dra. Liz Santos,ac7NInIr_$,Provident adipisci reprehenderit explicabo minus.
Maria Laura da Costa,*$5QjYwMj8,Dignissimos esse quod.
Luigi Dias,%$5pKVfX2%,Molestias accusantium eaque exercitationem in.
Sophia da Cunha,6%rDw7OjAS,Nam doloremque debitis aut animi eius corrupti.
Felipe Fernandes,g0hVi1Ql*4,Veniam porro animi nemo.
Gustavo Abreu,#2^hvHVm_x,Ipsa fuga quidem nesciunt cupiditate natus.
Bianca Santos,v+f99CiqDw,Mollitia laudantium odit non provident optio.
Sra. Heloísa Fonseca,%1IUr%u*3J,Fugiat ipsa reiciendis. Beatae quia fugit minima.
Ana Garcia,+LFN2Qd3xi,Dolor minus vero accusamus quibusdam.
Juan Siqueira,@#9HEMNjZj,Commodi minus temporibus molestias.
Dr. Otávio Barros,oz$GYmft*2,Ab libero porro deleniti optio.
Valentina Andrade,jd2WZrmy2%,Exercitationem blanditiis provident illo.
Brayan Nascimento,&0dV+7Dh&X,Temporibus voluptas aut nihil autem dolor atque.
Dra. Mariana da Costa,sA(3MzDrtN,Quas iure veritatis quas perspiciatis.
Brayan Sá,U9qLMPhx+0,Ipsam ipsam dolores molestias distinctio vel non.
Anthony Nascimento,m5+iZYuq&E,Perspiciatis in dolorum sequi quidem.
Nicolas Gonçalves,Zs$p7Yxu_0,Ut a dolore quam eveniet voluptatem.
Cecilia da Rosa,@qCJkz4fu6,Suscipit hic illo qui placeat tempore maiores.
Srta. Mirella Borges,)313UavkW+,Amet perspiciatis dolore at quia impedit.
Dr. Pedro Lucas Andrade,C9)ySO4g%Q,Magnam quam iste ratione ea.
Lívia Marques,*6UdRtqz&U,Architecto quia omnis beatae dolorum modi porro.
Felipe Sá,LmSUs_)0&3,Officiis laudantium quod quasi incidunt.
Henry Dias,g3p$6yKwJQ,Libero quam cumque dolores.
Levi Porto,%)N49rTui8,Ad tempora magni sequi ab.
Srta. Gabrielly Sá,3rZ7y(O2&J,Ducimus doloremque praesentium sint dignissimos.
Dr. Theo Cassiano,&MUw5sLh7W,Ipsa neque blanditiis.
Lucas Novaes,%6Qa&tPa+B,Ea aliquid debitis odio eum doloremque labore.
Dr. Samuel Lopes,&MJki(MF38,Magnam autem minus enim accusantium quam porro.
Hadassa Barros,sd91mS6r&Y,In cumque fugit quibusdam.
Srta. Nina Moreira,#rHCbIup*0,Ex aspernatur numquam nostrum non tempora.
Ian Aparecida,YN9cSiEJ+1,Pariatur veritatis voluptatibus asperiores.
Rodrigo Rios,&C8YoajFKx,Voluptas illo velit tempora.
Maria Luísa da Costa,F5q%Dnpf^),Quia sint eveniet sunt.
Sr. Kaique Camargo,a!MHxvIv#0,Dolores doloremque repudiandae.
Enrico Guerra,Zrnb5_Zn4+,Beatae doloribus numquam voluptates.
Ravi Azevedo,20^qYPtt*p,Minima neque fugit quidem maxime aut.
Sophie Rocha,sC@a3(RcJr,Fuga harum amet totam amet id.
Melina da Rocha,_YQPkN7rO3,Recusandae error velit laborum numquam explicabo.
Dra. Sara Jesus,@t2u2DcmCU,Omnis eligendi non quae.
André Sampaio,5jCA4r^x@D,Consectetur atque soluta exercitationem culpa.
Maria Alice Ferreira,#35Hhi1y#1,Sapiente illum pariatur maxime.
Mariane Ferreira,qB7ZqKwz@1,Explicabo molestiae odio asperiores maiores.
Beatriz Pastor,TCv4SfeMO%,Porro quo eius delectus dolorem cum.
Maitê Borges,%D_8MOKd8+,Similique similique est quae quasi vitae.
Antony Cassiano,cTS*4Get)6,Dicta quibusdam perferendis nemo neque.
Bento Moreira,!G2O(Uzzl5,Doloribus inventore iusto deleniti non.
Nathan Marques,&Ew#DWKmk5,Natus fugiat omnis fuga soluta.
Davi Miguel Sales,8e5BTenN!F,Repudiandae facere dolorum neque odit.
João Gabriel Rezende,&C6KvSIzhK,Tenetur corrupti sapiente aspernatur.
Bryan Machado,_3oQxGPe@F,Animi dolor quisquam ratione nemo aliquid eaque.
Thales Cardoso,%qWf)r$Cx8,Consequuntur dolor vel harum velit amet.
Augusto Oliveira,+xILH3PJ@3,Provident deserunt enim facilis molestiae.
Pedro Henrique Rezende,Ct1Y&f5@g@,Asperiores sunt adipisci est odio accusantium.
Davi Miguel Nascimento,A3C1uRyY^y,Optio est incidunt cum quod iure itaque.
Daniela Novais,N4Ggdi%2$L,Ea deserunt eligendi voluptate.
Arthur Gabriel da Conceição,zP6Ow5OlQ(,Reprehenderit corrupti itaque magni consequuntur.
Lucas Gabriel Borges,@_NkcQX&3N,Laboriosam aperiam corporis rerum fugiat.
Dr. Lucca Duarte,596AfWhY#F,Ad amet molestias iure eveniet.
Paulo Rezende,_7T)4ESXNv,Soluta assumenda quam facilis sapiente.
Yan Ribeiro,3e!0NHThvz,Odio quasi molestiae quasi unde rerum.
Enzo Gabriel Fogaça,tu)S$5ZsOl,Autem voluptate cupiditate repellat.
Henrique Mendes,)sSJo!eaj2,Placeat laborum id earum harum iusto ipsum quis.
Srta. Ana Beatriz Lima,%JNeagXz4r,Eveniet esse corporis perferendis commodi modi.
Kamilly da Mota,^+5Y)3Gn*k,Tempora repellat distinctio consequatur dolorem.
Maria Clara Pimenta,!v9FPUO&L^,Enim incidunt inventore est commodi.
Dante Ramos,b#blcEd4@9,Quis eveniet rem tenetur aperiam.
Rhavi Rodrigues,^G5iAOVvYw,Optio amet libero adipisci quaerat.
Liz Costa,o$2ZQmejSU,Ad asperiores doloribus.
Isabela Aragão,LF9GUgxA$%,Iusto commodi est. Molestiae fuga natus harum.
Sr. Cauê Cirino,0OIVZgth_6,Hic architecto ab soluta et adipisci.
Pedro Henrique Castro,%1PWOLhn$G,Modi eius aliquid adipisci dicta suscipit.
Nathan Viana,t@6(_bEjKr,Provident totam delectus error blanditiis.
Miguel Araújo,@7xnfQIAGj,Corporis totam repellat deserunt error dolorem.
Dra. Zoe Macedo,yaQk3TLV7*,Dolorem dolor iste libero aperiam.
Sr. Josué Siqueira,P+1o$Izj)*,Accusantium voluptas vero est facere cum officia.
Luan Rios,%w(OeNXx)6,Et omnis deleniti eveniet.
João Teixeira,%P0mSMaq_3,Exercitationem nesciunt itaque.
Valentina Melo,QZ*I0DdQ*B,Minima odio nulla maiores.
Enrico Ferreira,)UJ2LHtCzg,Adipisci maxime doloribus maiores reprehenderit.
Otto Ferreira,t(1)YiZDw8,Ab labore nobis ratione rerum illo.
