nome,senha,mensagem
Dra. Nina Moraes,cTW)2K8qd+,Nostrum quae asperiores neque.
Milena Viana,Z2MTmhSP*r,Ratione amet assumenda earum veritatis aliquid.
Anthony Sousa,3b1AjTvc4(,Expedita laborum quae enim.
Davi Moreira,8!X84LKfnQ,Ex consectetur et iusto eaque.
Emilly da Paz,#4KKwU^oEP,Eveniet amet rem ad nam ipsum nobis perspiciatis.
Cecília Vieira,45AKwQKu+w,Eius soluta labore unde natus ad earum.
Caroline Leão,&y8UIMo67&,Maiores saepe amet tempore.
Dra. Maria Laura Lopes,ewH!4NmexP,Fugiat facilis quia harum labore.
Alexandre Souza,Q!0vpEnx1*,Consequatur neque veritatis in aliquam.
Maria Liz Barros,W%x@u+HhK7,Ipsa labore fugit.
Cecília da Conceição,^Y1s1ZoDxc,Quidem inventore voluptatibus alias maxime.
Srta. Maitê Cunha,S!6P+6iqd&,Voluptates amet dolorem quis ab odio.
Léo Costa,&3Ea9d#TKZ,Cumque fugit veniam praesentium.
Caleb Novais,X5OIitUu@D,Voluptates ipsum qui sunt perferendis.
Anthony Oliveira,$l8kJH7r&M,Ducimus ducimus odit reiciendis.
Isabella Correia,@ST28BWfXj,Necessitatibus tempora voluptatibus accusamus.
Sra. Ana Moraes,%xSlPDj771,Repudiandae cumque cum reprehenderit.
Lucca Nunes,O*6*CxEz#7,Ipsam dolorum saepe illo expedita.
Sofia da Cunha,Xw(!1Fq6JF,Vel odio expedita esse.
Carlos Eduardo Caldeira,KijIIcvX&3,Inventore dolore illum mollitia officia.
Srta. Eloá Costa,%Q3Se^DFo!,A occaecati atque ut.
Cauê Nunes,04PlCd)1#+,Neque architecto ratione quia. Ipsa unde maiores.
Bárbara Fonseca,+NVNYAq!4q,Perferendis commodi saepe nobis.
Letícia Gomes,V36DfCis#t,Vitae saepe laboriosam excepturi.
Olívia Novais,%XuG2jMoE%,Doloremque corrupti maxime ipsum nihil.
Luana Moreira,6KhJdo_T%!,Possimus at saepe odio vitae repudiandae.
Carolina Cavalcante,@(pc7YsOax,Excepturi delectus veritatis nostrum asperiores.
Heitor Pereira,fHJ2fAzS+D,Id asperiores deserunt exercitationem.
Davi Luiz Farias,3p^9zR#x+Y,Eius nisi sed.
Sr. Valentim Freitas,h3UJH*pb^),Maiores optio expedita nulla.
Brenda Ribeiro,9hu+&9Xpm$,Maxime enim tenetur mollitia.
Heitor Pereira,ZS4@p2zsv#,Eos doloremque esse saepe est consequatur dicta.
Dra. Marcela Rezende,4h#tZoNd&6,Facilis incidunt repudiandae natus dolor.
Lucas Gabriel Martins,v^V_Jud1(7,Rem vel accusamus aut voluptatem beatae.
Alice Camargo,v*Kak+LQ&5,Tempore minus laborum a.
Ayla Pinto,@Ag!67JrP$,Magnam vero quidem dolore.
Thiago Lima,ws%0@HI)K^,Quasi placeat optio cupiditate.
Dr. João Gabriel Borges,xM4sN6Hk#A,Quasi nulla repellendus illo et.
Dr. João Felipe Caldeira,+$n6FLcUeg,Veritatis voluptatum sed laboriosam quaerat.
Kaique Duarte,$2XczLDnNB,Unde consequuntur laborum exercitationem.
Ana Sophia Oliveira,@8+1AuhNqv,Ullam temporibus perspiciatis veritatis.
Kaique Pacheco,x82RqnM0&@,Fuga odio ratione provident.
Dra. Ana Lívia Peixoto,)n82GDcN7L,Officia debitis itaque iure vitae.
Luana da Cruz,j%8JZaFf&l,Facere ea esse porro culpa autem.
Maria Isis Camargo,w$y49VltZ%,Sint cumque sit illo accusamus.
Theo da Mota,Gtbf0UOP^_,Tempore nobis quos.
Bella Teixeira,H7tLXBpg%P,Quas deserunt fugiat quis cumque.
Olívia Pires,&8fHRp+aSh,Ratione repellat eos incidunt dolore.
Ana Júlia Peixoto,v&5OsnIuHy,Iste tempore libero perspiciatis.
Calebe Costa,&6PQgoUfRn,Quasi in debitis nam magnam ipsa totam ipsam.
Otávio Sampaio,*#4Tpy2f*6,Culpa ea facere dolore.
Liz Costa,v_0PeMgKTy,Optio asperiores corporis cum.
Sra. Fernanda das Neves,#2r2sToBL+,Ex labore harum officiis eum sunt.
Carolina das Neves,h55TI4cG^W,Quos magnam quae nam corporis.
Sophie Cassiano,X1$+Tzqa)D,Pariatur tenetur assumenda incidunt minima.
Daniela Pastor,RE7iH&tj^6,Fugiat sint possimus nesciunt.
Alexia Ribeiro,UQ3QyfGrZ#,Placeat nobis sint repellendus odit nemo.
Dr. José Miguel Mendes,!I2hM*VoFe,Quo ipsam eius velit magni porro iure.
Ana Beatriz Peixoto,TN1%Mgsyq!,A error aliquam explicabo ratione saepe iure.
João Pedro Câmara,z391(VTdg#,In fuga laborum placeat exercitationem.
Arthur Gabriel Pereira,n)6WpR_uq+,Ipsam error modi dolore error.
Nicole Moreira,#2UBLM#m1p,Unde ipsam consequatur asperiores.
Sr. Vicente Pimenta,!82qpOJmtW,Quisquam inventore rem nisi illum omnis unde.
Raquel Cunha,(!9!Ekr_f@,Nulla laboriosam perspiciatis eum omnis.
Maria Cecília Nascimento,)Y48zJzsD3,Tempore illum asperiores deserunt mollitia.
Mirella Gomes,46(2V+3kMf,At ipsa voluptatibus molestiae.
Emanuel Freitas,_9$1Cdu4iK,Totam autem provident possimus.
Henry Gabriel Castro,!br2OxjaQB,Aliquam recusandae quo consequatur.
Dra. Evelyn Nogueira,_4O2cIsuQ5,Nisi earum facilis dolorem minima quas.
Clara Ramos,TL^0N6cg&1,Illum quaerat iste eaque.
Gustavo Henrique Costela,oC(Z6)DvzM,Quaerat consectetur consequatur cum.
Gael Siqueira,vx+g(7SsDe,Sequi quas quae molestias omnis saepe.
Léo Fonseca,+0e*bVJWZz,Quam saepe cumque repellat odit maxime natus.
Kaique Andrade,Ji3w8AOky^,Possimus quasi harum autem neque autem.
Pietro Barbosa,!9ZlmF8p4M,Tempore atque distinctio expedita quam.
Srta. Emilly das Neves,$F1I&FvU3x,Numquam magnam ipsum placeat quae.
Anna Liz da Rocha,TT*91ww2^8,Cupiditate odio enim quo et labore.
Ana Liz Macedo,0+R9WuOdpD,Placeat sapiente placeat ipsum ad.
Mathias Fonseca,ahr3Ef4Fh&,Asperiores earum voluptas aspernatur.
Srta. Cecilia Farias,r%2IBpcwsA,Dolorem omnis ab optio alias.
Vinicius Moreira,)Nbea4Gk&o,Quos animi dolorum voluptate harum voluptatem.
Melina Novais,+0DhxQUd*p,Cupiditate sapiente beatae doloremque.
Dra. Marina Silva,(45E2EyeL_,Ratione neque aliquid corporis vel molestiae et.
Maya Azevedo,D0w@DMew%x,Vitae provident sint explicabo.
Fernando Dias,^_I@T2Mm@u,Quo eum enim vitae.
Benicio Dias,*9yv5A7fF@,Labore excepturi modi numquam molestiae modi.
Cauã Sampaio,goQe%x6&)2,Quibusdam quia fugit vel.
Vitória Montenegro,(2SM_DF*mN,Ad ad sit numquam cumque.
Sra. Ana Cecília Costa,Ak)94G&td7,Possimus quam omnis in odio eum adipisci.
Benício Sá,dXfh4EFyN(,Minima quisquam voluptate ratione.
Maysa Aragão,DKFWSg%q%6,Animi unde enim accusamus accusantium.
Ana Luiza Teixeira,7!761Iu6xw,Voluptate perspiciatis exercitationem adipisci.
Srta. Alícia Brito,!XYH4_5u3Z,Possimus deserunt nam.
Maria Luiza Borges,u!I7(Zh&Q0,Sed architecto tenetur debitis.
Dr. Anthony Gabriel Andrade,$q37XyS&(c,Dolorem molestiae quasi incidunt velit.
Olívia Moreira,ug$6Tli9Zo,Reprehenderit rerum quos ab quis.
Cauê Macedo,e+pu4GIdb^,Doloremque sunt suscipit nesciunt iste.
Mateus Vieira,%sr!0JCpe@,Earum numquam ea eos debitis ipsum.
Maria Sophia Albuquerque,!wbDBwaxJ1,Ullam aliquid eum nemo.
Nathan da Cruz,#MrcVRmoE5,Illum recusandae culpa non.
Gabrielly Melo,y!9D!Gz51p,Quibusdam dolor laborum amet quidem.
Nicolas da Conceição,j%j8WKFtk7,Laboriosam voluptas quaerat quis laboriosam.
Arthur Gabriel Moura,KpzO1Peb^u,Minus sed id architecto harum laborum unde.
Bruna Rezende,z@z7i(YgT5,Saepe amet deserunt sed.
Gustavo Pereira,Ju7Yd3Kf&4,Ratione nisi repudiandae.
Dr. Diego da Cunha,r387MnS9u(,Molestias cupiditate ab.
Vitor Gabriel Montenegro,(#9KGxhGp^,Rerum iusto a magnam eligendi tenetur.
Lucas Montenegro,(1TeMvcU7G,Quas illo quod quibusdam ut aliquam quam.
Yan Leão,sOkS5GIq3&,Ratione nostrum ipsum quia sint excepturi.
Benício Duarte,nj@g%9LkOy,In nemo recusandae impedit perspiciatis.
Dra. Daniela Carvalho,yA4YKH&hO_,Dignissimos a rerum perferendis.
Arthur Gabriel Fernandes,+%8_lOlpIE,Exercitationem dolorum inventore quae.
Evelyn Ribeiro,+zYXvf7j#1,Ipsam quidem quia nihil ut ratione.
Rael Rodrigues,!E1E*p)q2#,Nulla quas enim.
Lunna Vieira,__DN7HLpR8,Id impedit quidem fugit animi unde eius porro.
Amanda Nascimento,#h)9C92btj,Debitis aliquam numquam cum.
Luigi da Rosa,pQ)5U)wxb%,Similique aliquid dolorum numquam.
Theodoro Jesus,(g)3KNTlF#,Et quam consequuntur consectetur aliquid.
Arthur Gabriel Jesus,E^0ajqbO#R,Velit voluptatem minima.
Sr. Luigi Caldeira,$3qRT%ry+F,Tempore possimus eveniet at iure laborum et.
Thales Freitas,H0ZOv9As#V,Soluta distinctio quod a non porro magni.
Bella Ramos,$N&(OEGpn4,Distinctio cupiditate earum impedit eius ducimus.
João Felipe Nunes,%EUKws18@8,Hic qui a ea.
Lorena Ramos,k+@)3+Xtc0,Quia error dolores laborum magnam.
Isis Vargas,#4aFnGn(DQ,Harum pariatur deserunt vitae.
Henry da Conceição,w97QzKvI*i,Fuga quaerat ullam suscipit.
Sr. Rael Almeida,))2@%HKxL&,Dolore necessitatibus maiores.
Lavínia da Mata,&T@tN(qx&8,Tempora recusandae harum fugit minus.
Luigi Marques,)RAP90XkOx,Nulla labore excepturi consectetur.
Dra. Maitê Costela,#3eBQ^ql+p,Numquam magni itaque porro.
Calebe Azevedo,O@1AGXgUVv,Blanditiis corrupti architecto provident hic ea.
Clarice Melo,%^64PwTZIU,Nisi autem inventore quidem consequuntur.
Lívia da Conceição,r3eV8Kp*f!,Omnis pariatur tempore.
Dra. Maria Sophia Andrade,pf86Mm1zd(,Molestias rem dicta quisquam earum natus ea.
Arthur Nunes,)n7S#AWp9w,Vel voluptatem porro unde. Incidunt id molestiae.
Júlia Marques,q1^XfYwk_k,Inventore cum nihil sunt sequi et.
Sr. Yuri Nascimento,f_Bm1ioCnF,Tempore velit sint consequatur.
Emanuella Rodrigues,O5!Sh!JF&_,Cum nesciunt reiciendis error unde fugiat.
Dra. Isabelly da Rocha,Yt9hC3lm_q,Ipsum quam hic nobis reiciendis laboriosam.
Maria Helena Barros,#6VLFnTcv+,Odit officia error quia natus.
Pedro Costa,#QMQEgm!Z3,Libero laborum modi optio sequi eos.
Theodoro Sá,CPNLtFnO^3,Vel dignissimos amet tempore tempore.
Catarina Leão,(Ld0Dks2Md,Sapiente rem quas eius earum reiciendis vero.
Bryan da Cunha,#%X$2McV2h,Consequatur laudantium nam a debitis voluptate.
José Miguel da Costa,#MY7oiFz5B,Temporibus deleniti veritatis provident.
Bruno Barbosa,!MJSkuTR78,Voluptates sed accusamus a quos.
Marcelo Teixeira,8^P8fPpC^),Esse numquam non autem eius.
Kevin Rodrigues,2d*1VIIcUu,Quos sed maxime nam laboriosam atque beatae.
Dra. Alana Costa,VL22MkhC$+,Porro ut consequuntur at repellendus.
Maria Sophia da Cunha,p!5cSQghmq,Culpa accusantium possimus amet eligendi.
Lucas Fogaça,_(99FcteG),Porro nostrum eos quia doloribus culpa minus.
Alana Barros,C0*u0NVd%3,At recusandae voluptatibus tempora rerum quam.
Rhavi Pereira,*7MuGgSvT5,Dolorum minima expedita ad sequi quos optio.
Pedro Henrique Rodrigues,4c3+WrFod_,Praesentium enim debitis eaque.
Miguel Silveira,E5Nb+ahb)U,Nam alias ullam adipisci deleniti.
Mateus Pinto,xs_8BeQPNB,Cupiditate aut assumenda cupiditate eaque velit.
Julia Monteiro,)XM3CBxk90,Vel tenetur quam odio ipsum perspiciatis.
Sara Pires,^nP0MOYhgV,Possimus veritatis laborum iusto.
Mateus Novais,l^J2Lwye@_,Delectus soluta sequi nesciunt dignissimos.
Breno Borges,tv9mx&Td#0,Voluptatem modi facilis amet.
Henry Gabriel Mendonça,e2AzYmZQ)q,Rem dicta impedit suscipit error dicta.
Bruno Pacheco,W^_0Up$x0d,Commodi dicta error totam ab deserunt.
Stella Andrade,*@8M0ZLqEJ,Suscipit distinctio neque.
Sr. Otávio Sales,CNN2A$NxI(,Excepturi recusandae debitis atque accusamus.
Dr. Antônio Lima,)%2+2Qe)Z_,Pariatur vitae veritatis.
Davi da Mata,4z^T4Fv5^K,Ea debitis accusamus iusto pariatur illo.
Sarah Castro,p$1RroVHSr,Nostrum fugit natus sapiente doloremque.
Rhavi Teixeira,i2fGX%Xz!!,Placeat veniam cupiditate dolores dolorem.
Maria Clara Fogaça,%96PWIVaXp,Laboriosam dolor inventore cumque necessitatibus.
Olívia Marques,3a1AgDFP)^,Nulla aliquid quod libero rerum ipsam vel.
Gabriel Nunes,$E4USXg+Ud,Omnis ab porro repellendus.
Dr. Léo Moraes,(P0OTZ9rO7,Qui harum occaecati corrupti ducimus.
Sr. Breno Aragão,@sFy7Jaa4d,Non dolores facere culpa quidem eligendi.
Ana Lívia Nascimento,@4fBPnJtkK,Ab similique quo dignissimos quaerat.
Dr. Samuel Freitas,Qg1T2DGk6%,Consequatur culpa minus cumque.
André Gonçalves,+^bB7ULjs^,Eius animi quo voluptates.
Augusto da Cruz,!jnIlPBjT6,Laudantium illo molestiae pariatur neque.
Kamilly Lima,MW8Yb%ylo!,Explicabo explicabo assumenda adipisci impedit.
Breno Macedo,@09OVocfSG,Est inventore et sint fugit dolorem.
Dr. Gustavo Henrique Fernandes,WJ9rf8r+$$,Qui corporis suscipit.
Alexia Marques,T@X1MhEE@+,Ad quas unde tenetur facilis accusamus.
Sophie Fonseca,e8G07Nyw)p,Occaecati dolor est beatae inventore.
Jade da Conceição,6#Nte1zI%b,A recusandae fugit facilis earum.
Caroline Pinto,)6FTo)gj5d,Doloremque cupiditate fuga.
Bento Rodrigues,kG_7gU2dYW,Laborum sapiente illo maxime alias.
Samuel Gomes,)4fI$bx8+7,Animi expedita quam laudantium.
Melina Siqueira,beU&4jQmiS,Exercitationem ducimus tempora facilis.
Isaque Abreu,39BguxUk@$,Pariatur libero sapiente ab qui temporibus error.
Daniel Aragão,_2G&n5AzOZ,Sunt possimus perspiciatis debitis similique ex.
Srta. Lunna da Cruz,_qy4VLqukD,Reiciendis enim aliquid accusamus ullam ab culpa.
Dra. Maria Sophia Vargas,p!1q@ZqiS*,Officiis omnis exercitationem.
Luna Costa,2kv6In$sx^,Alias vero ut accusamus expedita ipsam.
Enrico Aparecida,+j1zOPpj4!,Aperiam voluptatibus quasi nulla sequi.
Yan Aragão,R4S@x^Mt)U,Fuga esse exercitationem animi repellendus.
Nina da Conceição,o2Z8TADqi!,Commodi inventore omnis eius.
Dra. Maria Sophia da Paz,^wxrCXsv%4,Reiciendis quibusdam facere architecto.
Benjamim Barros,)3aJ(uyhWv,Commodi nemo expedita.
Ana Júlia Vasconcelos,bZ8Sp3UL@N,Officia voluptate autem voluptatum quod.
Davi Luiz Lopes,ckYns1Wsp),Exercitationem ad dolores iusto.
Erick Almeida,a+H*0NXjK@,Quo enim vitae animi blanditiis ea accusantium.
Matheus Pacheco,a*7MqPhdzw,Id nesciunt sequi ducimus architecto quasi odit.
Sra. Maria Julia Costela,Gc$86IWlyR,Illum doloribus doloribus officia ex.
Luiz Otávio Pereira,^&Ll6THhK5,Fuga velit tempore deleniti.
Gabrielly Fonseca,LzGo^ncy#6,Amet placeat atque doloremque.
Dr. Valentim Pacheco,^p1D%y^z!9,Natus perferendis voluptatibus assumenda.
Rafaela Brito,!1hGSlxif9,Corporis distinctio minus explicabo.
Esther Albuquerque,*_P9xZ)p6C,Quo quam nulla sint reiciendis.
Ana Liz Barbosa,cuM2HxrCB%,Natus earum sint quaerat.
Dr. Samuel Rodrigues,(9SBt80v7W,Nam quis voluptatem.
Melissa Garcia,(HbsMEGT0h,Maiores autem laborum.
Sr. Levi Araújo,!^10ifUg%H,Dolorem nostrum itaque eius animi in.
Allana Freitas,NlESV52z^5,Unde eveniet quas culpa.
Isabelly Gonçalves,#XNoZprWy2,Doloribus dicta alias accusamus ea amet minima.
João Gabriel Peixoto,Yz)d1W%V#!,Magni dolorum alias aspernatur quam.
Dr. Bruno Cardoso,zVFI4Ux9v!,Occaecati rerum nam ducimus facilis.
Marcela Barros,%9+VJo2c%u,Doloremque vitae magni necessitatibus.
Yuri Guerra,@36jIDpF&7,Iste sapiente voluptas fugiat enim.
Davi Lucca Alves,!o81TCLBL1,Sequi sint iusto molestias quae deleniti aliquam.
Benjamim Dias,Li0dzMaUF*,Eaque et maxime soluta.
Joana Nunes,+tZYT_fE!1,Qui assumenda eveniet hic illum esse molestias.
Luiz Gustavo Ribeiro,9aGXqqzw)W,Porro asperiores voluptates ipsa.
João Pedro das Neves,zm*8PaTp#J,Commodi molestias sint cupiditate modi.
Lorena Peixoto,%pkQaClgA2,Corporis totam quia saepe.
Ayla Moreira,@p!+LBP&Z0,Commodi eius nemo delectus repudiandae numquam.
Agatha Alves,ghH4^F^Jj@,Odio cum cupiditate quis.
Sra. Laís Barros,+AJF8)fN1c,Eum similique est accusamus.
Mirella Duarte,#*$EcBjx$7,Ducimus illum tempore possimus.
Pietro Borges,+**0XQsMZr,Sunt corrupti cum assumenda.
Marcos Vinicius Aragão,_g4VqgVtC&,Tenetur quod consequatur maxime exercitationem.
Bryan Monteiro,pXcBbdbf$7,Consectetur excepturi accusantium hic quae hic.
Yago Fonseca,M97XTgJv&Y,Minima aspernatur deserunt commodi ipsa.
Clarice Cassiano,8kK6Oae)N^,Itaque in sapiente at illo optio quasi.
Maria Júlia Vieira,#uz7aXVa#&,Ad nulla cum minus corrupti.
Ravy Peixoto,e&D5#JHOuy,Nesciunt illum unde ex quas.
Heitor Freitas,#6s03&HtQk,Incidunt sunt non rem.
Milena Borges,Oz!3KgxH3i,Quae blanditiis deserunt culpa.
Heloisa Costa,vv&+E4Wn(u,Harum consequuntur repellendus.
Lucas Pires,(5ds9gSb_A,Vero explicabo enim.
Ana Beatriz Moura,9_HHw2%%#3,Saepe aliquam temporibus.
Sr. Renan Gonçalves,!Vdp%#Br0v,Quod dicta ad accusamus beatae delectus iusto.
Antonella Lopes,s*4dNQ$a*A,Fugiat neque corrupti possimus expedita.
Eloah Silveira,(6Y%s)Lo5E,Autem sunt repellendus hic rem dolore.
Mariah Melo,!lF$l5Xv*3,Molestiae sit consectetur.
João Guilherme Almeida,4PC)HTAd!p,Amet quis suscipit itaque minus.
Isabela Gomes,)&V@4HGmk(,Possimus quod ducimus eos blanditiis.
Lunna Alves,@J7rd_Tx!+,Sint fugit quia error quasi non debitis.
Sophia Aragão,(Oq6Qk_+KE,Sit nisi expedita minima qui.
Raquel da Cunha,$b5Qpyaac8,Labore inventore eaque quas.
Dra. Esther Vargas,X(DX2CYdMe,Consequatur cumque sit.
Alexandre Araújo,^5wQz+xuI6,Tenetur iusto blanditiis harum ullam.
Théo Gomes,u3GgL_lJ&f,Repudiandae architecto nisi labore ullam id.
Sr. Mathias das Neves,T*4PYT@u*),Corrupti eius nam explicabo est.
Erick da Cunha,hVHf6Lmj%8,Officiis minus a occaecati aliquam labore sequi.
Mirella Macedo,qr7jhGkA!T,Cum magni libero. Libero debitis animi.
Gabriela da Mota,gP87RiZsU(,Dolor quisquam magnam omnis rem minima.
Eloá da Rosa,AM)p5MZxD1,Suscipit facere accusantium fugiat.
Maysa Carvalho,!xWUve2b7A,A cum unde quia eaque. Occaecati omnis enim nisi.
Ana Laura Almeida,&zSo!s4yP9,Occaecati beatae maiores eaque recusandae.
Isis Nunes,L*q2iMCfBj,Itaque facere et iusto et odio saepe.
Sra. Isadora Farias,_N%SSU0q*9,Odio eos labore autem.
Miguel Brito,8mQV_p$3^S,Suscipit nisi illo atque.
Antony Nogueira,R$!2kdDsGY,Ab nesciunt voluptatibus odit maiores velit cum.
Sabrina Pacheco,fP1XNctT#5,Voluptates in est alias.
Luiz Miguel Souza,1!&2Y)rHLL,Nemo iure ullam nam quo.
Danilo Costa,$Y%bVvCD7o,Voluptatem neque placeat nobis.
Alana Martins,*3Gf1i!g@),Odit corrupti beatae reiciendis rem eum.
Gustavo Henrique Nascimento,@1Z5Wk3++8,Dicta perferendis distinctio corporis similique.
Kamilly Santos,h0f@M6y&*n,Incidunt quasi praesentium quam odio.
Cauê Barbosa,(dw0Ta*C1+,Earum ex minus aspernatur numquam sint.
Dr. João Guilherme Pastor,@eXTCdqm!7,In quis molestias neque.
Levi Fonseca,%++4euOsSh,Nulla quo id voluptatum.
Henry Aparecida,*1OyXNqgRX,Optio magnam excepturi vel dolores quos.
Alexia Costa,#5LU3Wya#7,Accusamus asperiores eaque odit libero.
Sra. Hadassa Martins,IzW52LLo*5,Impedit consectetur in libero.
Maria Laura Fogaça,kOh+63Dj^^,Quisquam mollitia ab atque.
Isabella da Paz,%rDpQ1)F!5,Inventore ex ipsam qui excepturi deserunt in.
Henry Cavalcante,q+Y6mLyi^8,Fugit deleniti inventore hic iste in hic.
Srta. Agatha Campos,n!TO&5D+!5,Sunt quae consequatur rerum tempora.
Maitê Marques,68VqvhSy@b,Amet ab perspiciatis porro repellat ipsam nemo.
Júlia Castro,X543m5)o&z,Praesentium nisi facere.
Aurora da Conceição,(YzCAGl30k,Quam dolores ut distinctio fugit.
Maria Vitória Oliveira,r5X*d+7z)4,Molestiae non perspiciatis.
Nina Sá,c(^4Fnp&o@,Natus animi doloremque sapiente.
Dr. Vitor Hugo Sousa,NV_97df3c_,Voluptas distinctio occaecati cupiditate.
Laís da Costa,*7SA!LWnr4,Doloremque nulla cumque nobis illum libero.
Guilherme da Luz,*16E&KOqgH,Fugit modi porro.
Dr. João Lucas Ferreira,t$0UO*xRh5,Vitae nobis id totam minima iure amet est.
Sra. Lívia Pereira,3x*2GAyO&7,Dignissimos magni doloribus architecto.
Ana Clara da Cunha,b+4W4EdTkE,Similique quasi cumque voluptatibus commodi.
Juliana Porto,&Sv8WEIdx7,Iste tempore molestiae enim cum id.
Bianca Silveira,)#EuqqjG1$,Libero eligendi ipsam nemo.
Arthur Monteiro,Q%1VUc*ox$,Quisquam ex quisquam qui.
Felipe Silva,D*4MSM1kKA,Voluptates pariatur dolore. Vel in pariatur quae.
Pietra Fogaça,4cN$z!vi^&,Iure suscipit praesentium nihil sapiente ea.
Carolina Azevedo,YFU4KhQdk%,Autem velit nam illum sit veritatis.
Rafael Novaes,DaNpx9n+_4,Veritatis totam quam rerum nemo veniam.
Catarina Rios,zhXHKuho^5,Exercitationem dolorem totam explicabo eligendi.
João Gabriel da Cruz,5!0AkT6_mh,Assumenda vitae illum earum cum quasi animi.
Lara Aragão,7@wM1WE1Iz,Beatae numquam delectus occaecati.
Sra. Lavínia Fogaça,6ZwGsyP8^3,Nobis hic facilis saepe provident sit quaerat.
João Miguel das Neves,+7zW*BrP*#,Quam magni suscipit commodi placeat quod quis.
Jade Mendonça,%o9LoyvuM%,Ad ad sit ipsa.
Dr. Heitor Cirino,C60BIXknL+,Labore non sunt dolores error eum illum.
Théo Albuquerque,dz4fF2SR)7,Consequatur cupiditate fugiat quis.
Ana Laura Lopes,!M%2Kmx2^W,Ipsam beatae cum at ut quisquam explicabo natus.
Letícia Rezende,&2W4mYed%4,Reprehenderit nihil similique laborum.
Brayan Nascimento,c#78jByn&X,Alias repellat quasi saepe vel.
Davi Lucca Mendes,!43SZJn&56,Totam voluptates minima quos magni aliquam.
Vicente Alves,9L%W6BFvFO,Doloribus nesciunt ea.
Mathias Freitas,X&5Q_2Ukus,Consequatur ipsa saepe.
Anna Liz Montenegro,f76Q8Nri$+,Reprehenderit sunt eligendi.
Sara Silveira,+7hhEwZ2AE,Eaque libero excepturi fugit quae a.
Ester Silveira,#6FYzQeiEN,Id nisi perspiciatis placeat delectus.
Caroline Brito,!@96TZUl#H,Impedit accusantium eos porro suscipit.
Pietro Macedo,KY!46SQzw#,Optio velit incidunt.
Srta. Ana Macedo,Qro8MCEf$y,Sint illo eaque deserunt.
Yago Cavalcante,P6&Leuf__m,Qui libero nobis laudantium.
Arthur Miguel Cavalcante,$RK5ZBhX!_,Earum aliquid recusandae sed.
Apollo Cardoso,ojo0LQqp*y,Nesciunt sed vel temporibus optio iusto illo.
Antônio Gomes,&5+InO1pfW,Soluta dolorum quod est labore aliquam eius.
José Pedro Moreira,@0STvqEJK%,Porro quas repellendus dolores enim ducimus.
Noah das Neves,r6NKuXI)_X,Quos soluta veritatis dignissimos.
Heloísa Rodrigues,*L0Ski)QSt,Natus iste quo temporibus.
Vicente Leão,fY7zQE*h@l,Ea architecto labore sint.
André Rios,$6yQTfAm0*,Nobis enim quis corrupti.
Vitor Pinto,rLT0GJxt&+,Quos odio nostrum voluptatibus.
Arthur Miguel Mendonça,zI88FEjO)0,Pariatur itaque non rerum.
Stephany da Rocha,&4Rid7uKuP,Corporis officia nobis officia mollitia.
Srta. Ana Clara Castro,2A4UBaV@h%,Illo id atque iure quaerat.
Antonella Pinto,H(5Ghz^L%L,Ipsa quas est id neque aperiam itaque nulla.
Benjamin Pereira,u3YZykKf@G,Cupiditate alias sint qui cumque et.
Alexandre Abreu,)6L&85UeR4,Vel iusto id.
Maria Helena Moura,*Y#1^OUkW*,Explicabo unde magni numquam earum repellat.
Lucas Gabriel Novaes,@3NN8Ca^S*,Voluptate veniam illum ab deleniti.
Carlos Eduardo Ferreira,BpgZN6m&_0,Ipsa nulla occaecati quisquam dolor.
Antony Araújo,(xfd1LJlla,Eum adipisci sapiente mollitia odit.
Daniela Câmara,E0ROwZf(^d,Cupiditate molestias provident.
Enzo Vasconcelos,@e+07ARnM@,Quia rerum quibusdam eaque odit.
Luiz Otávio Rios,Bo!3JL$f*S,Voluptatibus quibusdam sed recusandae enim.
Marcos Vinicius Rocha,L^c84Wozn2,Laudantium architecto iure ex.
Henry Gabriel Caldeira,$t6OBSjnr^,Tenetur amet labore cupiditate.
Brayan Sousa,2S0DEaijF_,Blanditiis fugiat nam.
Felipe Borges,v&ojAeS2Pq,Nemo dignissimos quia provident nobis.
Sr. Marcelo Aparecida,P$1bUABy1C,A asperiores architecto labore exercitationem.
Henry Gabriel Gomes,jT)8)Vyu64,Mollitia eveniet enim fugit accusantium.
Gabrielly Rodrigues,kU%FX6hs^6,Quam expedita libero.
Juan Brito,29D5rf4)&g,Est ratione quas quam rerum excepturi modi.
Eloá da Mata,+ILTc1(G95,Saepe sapiente provident porro delectus porro.
Emanuel Costa,R98kdYXN_j,Ipsam dolor enim iste saepe pariatur.
Dra. Maria Sophia Pinto,$48LapJMp8,Provident eius eligendi hic.
Dr. Thales da Paz,#7RUCCv#G),Veniam libero voluptatem.
Alexia Pimenta,U&45Pi_!D9,Hic libero dignissimos maxime officia commodi.
Dra. Ágatha Fogaça,#4qyq4LrtY,Facere quia expedita corrupti.
Marcelo da Rocha,$+1KVsxAO$,Expedita iure vero perferendis.
Dra. Allana Duarte,)fUFfDI$^3,Impedit optio recusandae asperiores.
Alexandre Oliveira,+0XZFyoF&0,Numquam ad maxime ea perspiciatis est quisquam.
Beatriz Novaes,8+Sw4O&lj*,Et eaque odio impedit autem nisi.
Sra. Amanda Farias,h!2TOZOjkR,Ad quisquam laborum similique dolores commodi.
Enzo Marques,)FpYI2o7^0,At qui sint culpa.
Maria Vitória Cassiano,i2STr+M&^f,Explicabo enim minima quos quia.
Cauã Casa Grande,*dSPNOc+R7,Ullam repellat ipsam sed eaque.
Maria da Mota,_F7#KMMoEi,Consequuntur error quidem nam.
Sr. Kaique Santos,!aVVU&xV5K,Omnis illo ipsum earum dolorem eveniet.
Maria Isis Silva,^^ZTT$BkZ6,Totam quam nulla quas.
Natália Albuquerque,*_SB(Adbp0,Sequi consequatur quas cumque odit.
Maria Sophia Abreu,&)0WcaMhCH,Quisquam quae cum quia eum magni deleniti aut.
Agatha Borges,8Vtu9Z#cB+,Natus voluptas soluta. Odio dolorem aperiam.
Marcelo Cavalcanti,!(K3IcM$oc,Eum facilis sequi maiores.
Asafe Jesus,L8DzPvnb^L,Molestiae impedit maiores.
Asafe Marques,l+3^2^%o(S,Reprehenderit similique sapiente maxime.
Emanuelly Fogaça,4q*DQqGg&n,Voluptatibus doloremque ex est molestiae aut.
Luan Azevedo,+A8QMhuork,Enim magni culpa nisi nulla soluta in.
Antony Siqueira,i&7cBIgpe*,Perferendis suscipit vitae.
Srta. Isis Novaes,Yn1U0^_%v*,Sunt dignissimos corporis nulla.
Júlia Freitas,$9+Ny*d0va,Vero esse mollitia.
Catarina Rocha,@2olEtrcRO,Accusamus facere commodi.
Marcela Camargo,LiNh)1+I&2,Harum eum atque suscipit nobis rerum.
Srta. Ana Beatriz Caldeira,&3HALlpglr,At quas ut repellendus dolore.
Noah Nascimento,&h3ASwb)w*,Molestiae unde saepe facilis tempore ipsum.
Sara Costa,E_2VXnc5(v,Recusandae nihil in officia nesciunt possimus.
Sra. Isabelly Fonseca,J(7wJ0&)7w,Est in laborum ut quis in.
Pedro Sousa,#33JopQ#1i,Nemo sit vero molestias deserunt deserunt illum.
Juliana Farias,73^Icj%z!R,Iure iusto magni rerum quo.
Enzo Gabriel Ramos,Gl$s8hOtjT,Dolorem veniam reiciendis est.
Heitor Peixoto,@8Yw%AsF&d,Unde debitis tempora hic.
Dr. José Aparecida,(sQOLt(46G,Dignissimos pariatur beatae laborum alias maxime.
Matheus Novais,+2oRiBlGmO,Perferendis modi repellendus sequi.
José Gonçalves,%f_4RIsSzM,Possimus laborum aliquam.
Oliver Lima,@DSI1rA7K4,Beatae eius saepe distinctio ea deserunt.
Josué Pastor,O7u!+Dtr*%,Iure maiores quasi laboriosam nobis.
Danilo Correia,c^8xDhkHR&,Suscipit vel nostrum neque odio quibusdam.
Renan Jesus,%s2PH^q*@Q,Quisquam ratione at delectus.
Sabrina Cirino,$1h#Qiqw2F,Magnam at id nesciunt impedit debitis.
Maria Laura Mendes,AQ6CKzZe1@,Iste voluptatem optio maxime consectetur aliquam.
Miguel Pimenta,&iLSKfwb_0,Similique dolorum sint aspernatur fugit.
Caroline Lopes,SOO2%oVt*2,Deleniti deserunt nam at explicabo.
Fernanda Viana,xFyOiXac#5,Vitae deleniti itaque dolore.
Daniel Rodrigues,(gg4CluWL6,Aliquam sequi unde nisi ratione animi.
Vitória Dias,aR1ugZcn^4,Sunt minima quibusdam sed qui.
Isis Melo,+jv7UCvmWl,Rerum accusantium animi omnis.
Benício Pereira,Wh5HTP(q#5,Quis aut quos neque doloremque doloribus.
Augusto Mendes,ulL*4fOG)5,Consequuntur est ullam beatae earum sunt ex.
Dom Pacheco,!cbyRr+fn8,Temporibus ex eius occaecati earum.
João Pedro Câmara,&3QXHP*nIv,Tempore sunt numquam aut exercitationem.
