nome,senha,mensagem
Renan Sousa,)6M2bwW9y3,Autem sapiente voluptas nisi distinctio eum nisi.
Maria Luísa Pereira,O55h#Uzc+V,Error optio officiis commodi.
Dr. Bernardo Brito,@pPa5+RoCz,Praesentium facere id vero rerum recusandae.
Josué Martins,)S1GGfcE8e,Et temporibus quidem sunt sapiente beatae.
Maria Julia da Mota,SJ3q9JfEx+,Explicabo eveniet laborum quo expedita accusamus.
Allana Teixeira,k0$9ZrSZXE,Ipsam nam maxime ut porro animi.
Otto da Luz,avA2Y0CY@),Reiciendis quaerat aperiam recusandae.
Dr. Bruno Alves,dfOCSv!6+5,Repudiandae neque quidem quas nostrum.
Maria Julia Cavalcanti,o3uZhT#f&e,Soluta molestias earum ipsam quam.
Ravi Lucca Sousa,%eXIr09h31,Tempora corrupti porro autem optio quo magni.
Bárbara da Rosa,2*_9AOwZb8,Ex neque sint. Velit rem voluptates beatae.
Antonella da Mata,(9F6Vsnn*d,Officia voluptatibus officiis blanditiis.
Levi Nogueira,@7!Q*hNonV,A sunt eos. Ex ratione error.
João Gabriel Nogueira,@5KOh0cLmi,Culpa dolore minima tempora praesentium quidem.
Dr. Juan da Rocha,P_1UI19oTL,Omnis aut optio quisquam quo atque iure.
Pietra Novaes,)0n1dVedET,Tempora unde sunt nemo quidem.
Heloisa Sampaio,J#4UH%TY5f,Inventore a explicabo tempora quibusdam dicta.
Srta. Natália Fernandes,%xx3Ck_zLv,Ipsa autem consectetur laboriosam.
Sra. Julia Caldeira,P^!21Ho2rg,Minus consequatur et iste voluptates doloremque.
Isadora Martins,+lQoDb1Q2n,Alias sit in vitae.
Dom Gonçalves,cx9@fAFjP$,Ut quo ipsam. Vero modi ipsa rem sunt molestiae.
Dr. Renan da Paz,H6oTLktv^d,Voluptatum porro ex eos commodi.
Breno Costa,SsU41sCoi@,Possimus ipsam nam expedita nesciunt labore.
Maria Laura Cavalcanti,#z3*6NEjpF,Cum deleniti amet.
Ana Beatriz Viana,%e_8KHoIIZ,Laudantium libero praesentium.
Rafaela Lima,V6GfF5Sa#@,Nisi in error nulla dolorum dolorum.
Liz Barbosa,#LVp7LMv0(,Officia cum commodi molestias laboriosam culpa.
Murilo Duarte,eG1%KTtR(^,Vel quod ducimus.
Raquel Farias,6H51aS#fQ@,Veniam at quae quos.
Evelyn Machado,Q5f&A+Wi)2,Aliquam magnam doloremque ratione.
Luiz Henrique Souza,34Fhd%nZ^A,Animi quidem cupiditate quasi.
Samuel da Costa,_JBKAL@oT5,Est esse sunt ducimus sequi eveniet corrupti ut.
Maria Cecília Souza,SDRaRtFJ(1,Atque deleniti magni expedita molestias aperiam.
Marcela Campos,W8DY$71u^w,Ea consectetur in hic.
Lucca Castro,u*1%V_s#Or,Nesciunt aperiam magni.
Srta. Hellena Costa,*2H+Bvzu4+,Ad saepe aut dignissimos minus.
Ana Luiza Monteiro,XZ$9XgdBv#,Quae exercitationem saepe modi nobis quia.
Srta. Maria Julia Rios,@Eo8Y^qu$5,Porro soluta voluptatum molestias.
Luiza Silva,^I27cMjvt8,Natus nobis praesentium unde amet.
Catarina Vargas,E7L!dEI!@L,Labore veritatis esse odit illo labore.
Lívia Nascimento,!1gM5DbdAR,Pariatur earum architecto.
José Brito,^6BnViruC$,Laboriosam at soluta quae illum quisquam numquam.
Bárbara Nascimento,$g3GkYq@n6,Possimus delectus laudantium vel sunt.
Sr. Matteo da Conceição,cX7D_vl@_s,Minus placeat placeat sed.
Maya Fogaça,QxTZB#J3#4,Magni rerum libero adipisci tempore officiis.
Dr. Lorenzo da Conceição,+Of$#6nZZ&,Pariatur eaque saepe dicta ea.
Sra. Luna Abreu,O5Gm+fzI^#,Est quidem officiis eveniet iste rem reiciendis.
Sr. Noah Freitas,(ud88BOle5,Magnam nulla fugiat mollitia.
Maria Julia Melo,$4UYXThDwd,Eius sit magni quas recusandae nemo et.
Alexia Macedo,)#Ai7FRyw7,Nesciunt maiores debitis.
Ana Carolina da Rocha,055Z^hNV#u,Vel praesentium aspernatur doloribus cupiditate.
Emanuella Viana,dTHr)s7nn),Optio molestiae autem quaerat facilis qui.
Laura da Cunha,O2%6L!SoSq,Molestias labore error hic ea natus.
Sr. Matheus da Rocha,(_A7Cds0Wh,Laborum tenetur vel tenetur molestias quas.
Ana Sophia Montenegro,WO1WidVO*1,Mollitia numquam dicta.
Marcelo Pacheco,FPH3H&tF+4,Nam ut repudiandae sint eveniet.
Dra. Manuella Souza,X_53ROEw@p,Consequatur sed id ut consectetur earum magnam.
Srta. Agatha Monteiro,91cbIZr4*n,Quisquam eum dolore asperiores rem natus.
Jade Sampaio,b+j8RL+mj1,Saepe eveniet excepturi distinctio reiciendis.
Liam Machado,^N52EfUcbJ,Ipsam veritatis sit.
Bernardo Pimenta,J7G44_If#I,Veritatis fuga ipsam eius explicabo fugiat nam.
Ana Beatriz Jesus,#jT%k!UI^5,Unde recusandae impedit at.
Lívia Pinto,9PZd1MQfa#,Enim libero fuga laborum animi.
Mariana Carvalho,gM2t4PxW%*,Voluptatem est accusantium odio.
Isabelly Fonseca,+1QX$PWz0e,Vel libero eos voluptates.
Dr. Gabriel Barbosa,)hKKa)sNv7,Aliquam quo deleniti.
Joana Campos,Nj*9mCaa88,Illo deserunt natus rerum voluptas similique.
Maria Alice Sá,LscOijv1(0,Beatae unde quam dolore.
Juan Azevedo,%4y1yAia+U,Rerum veniam deleniti.
Laís Gonçalves,Z0QdgzaC*),Suscipit molestiae sapiente sint.
Benjamin Farias,0n!R2DjFXo,Nisi modi occaecati ut maxime eveniet.
Jade Lima,&2W)KMsP$x,Earum corrupti esse quaerat.
Nicolas da Mata,!$eO3LKzq$,Hic ipsam velit quidem.
Julia Cassiano,*k3(Ml%B!$,Iste architecto qui saepe rerum assumenda.
Alexia Pimenta,^D8Eu_f6v&,Cum nobis fugit inventore unde.
Rafael Santos,o^30tFh08&,Consequatur neque dolorum error temporibus.
Sr. Samuel Garcia,E8RLgao9)m,Sint esse culpa mollitia.
Anna Liz Machado,i_N7CSgYJf,Tenetur illo laudantium necessitatibus earum.
Ana Julia Ribeiro,M3TTFugd_t,Consequatur molestiae omnis.
Davi Luiz Andrade,%k^E42Upi4,Iusto eligendi ipsam omnis nam vero suscipit.
João Gabriel Vargas,+*+3Zb7fh$,Itaque dolorem sunt soluta.
Alana Andrade,X84WbLPd$s,Dolor nesciunt dolore tempore.
Sr. Rodrigo Leão,#6Dva7R(@^,Sapiente quaerat consequuntur eaque numquam.
Sr. Isaac Novais,_2!7INnaQf,Iure excepturi quae sint vero.
Leandro da Rosa,(n72zBuw&),Ratione odio ullam est.
Vinicius Macedo,(3ZS&QD0Jn,Quis nesciunt occaecati.
Dr. Luigi Castro,#F@#1WQkzY,Ipsa magni blanditiis quia. Est iure enim sit.
Bruna Barbosa,L77K6#kfE!,Nihil minima porro eius nisi vel.
Sr. Diogo Freitas,W+4ryWil7e,Asperiores tenetur modi.
Isaac Araújo,pa5_XS*(+6,Eveniet provident voluptatum reprehenderit.
Theodoro Oliveira,#&5FBV@v%q,Quo tempora doloremque cumque.
Arthur Miguel Teixeira,&p1HbOv#@7,Voluptatum temporibus vero ipsum non perferendis.
Natália Campos,iuZDnw_#!7,Quidem eos fugit quasi.
Anthony Gonçalves,+(vbFZIuR9,Explicabo illo assumenda dignissimos.
Srta. Ana Carolina Pires,4a4EyXfg%Q,Hic recusandae iusto vero. Provident eius ea.
Theo Gomes,q1QexfJy(6,Natus eius quod porro labore dolore.
Eduarda Alves,B+Ar0IatcW,Quae deleniti assumenda.
Ana Carolina da Rosa,6rpgPQ5I*%,Modi quasi deleniti nemo fugit.
Nicole da Rosa,*8ZLv8jHY6,Non quo officiis voluptate ducimus vero quidem.
Srta. Maitê Mendes,_8YAxvo&!e,Minus enim consectetur illo laboriosam magnam.
Anthony Gabriel Novaes,wB_5Q5rJ^(,Voluptatem voluptatum enim aliquid sit eos.
Gabriel Cavalcanti,^QRq5YajK!,Repudiandae fugiat vitae facilis.
Emanuella Azevedo,ALOC4^r2+6,Labore omnis eaque. Modi dolorem nemo.
Enrico Porto,^32NH%naTM,Sapiente molestiae impedit rem nemo odit.
Maria Júlia Albuquerque,*cr@5Ipt2L,Corporis porro iste dignissimos.
Yan Cirino,%!HZFa1g+3,Quam quidem quis pariatur nulla.
Pedro Henrique da Mata,K!3fFksrrT,Facere nesciunt animi inventore quis minus.
André Ribeiro,A7)VVWpM*8,At illum perferendis. Dolores maiores reiciendis.
Maria Helena Pimenta,BaNtNvdT!2,Libero asperiores ducimus veniam.
Marcela Pastor,%Zz6Un)#@#,Hic nisi quam corporis excepturi aliquid.
Srta. Amanda da Cruz,*CO#19hy79,A ad error.
Beatriz Moraes,#*k4DA+z6c,Quas laudantium dolorem exercitationem harum.
Ravi da Paz,$EZC%Y%c2M,Voluptatum ducimus quas laborum omnis itaque.
João Vitor Cassiano,^a_gD(Jn%4,Illo libero iure delectus voluptates ducimus aut.
Vinícius Jesus,Fk5TXGJq@!,Quibusdam provident nisi repudiandae sit.
Pietro Duarte,O1FlH0_U$y,Repellat itaque exercitationem accusamus.
Luigi Monteiro,^19Tsj4OM7,Porro aspernatur quaerat quia asperiores.
Ana Luiza Fonseca,Dr(6OKb_+p,Cum aspernatur eveniet enim.
Dra. Maitê Ferreira,b)*mT7KtQm,Saepe saepe suscipit iste porro.
Mariane Aparecida,)%tjA1YxlL,Ipsam deserunt qui error.
Srta. Clara da Conceição,+P1gZusjPY,Qui recusandae ratione ea voluptates nisi odit.
Enzo Viana,*@9AAu$b4t,Ex ea est quos impedit nihil omnis.
Miguel Sampaio,!@I9wFQzW5,Provident unde quisquam expedita maxime iusto.
Srta. Amanda Moreira,r!@18CtemY,Fugit atque at quia sunt.
Marcela Correia,$7AI3vFaNn,Quis enim molestiae quidem enim.
Renan Barbosa,1x5Jz8w^@$,Placeat ab non molestias quidem culpa.
João Campos,W47BHhKck#,Libero ad vel aliquid odio.
Ísis Nunes,&YDV5Nw278,Expedita exercitationem cupiditate at.
Aylla Fernandes,rEBY6KMul(,Tempore pariatur earum necessitatibus.
Eduardo Moraes,Mvh1%JWk#%,Quod sint numquam quos distinctio itaque eius.
Davi Lucas Santos,6qq^LFrr@a,Officia totam accusamus sed est ipsum.
Luiz Felipe da Cruz,b6WS%Rrm$y,Nulla maiores nisi esse officia fugiat.
Carolina Teixeira,+ql1JOtre2,Voluptatibus quae tenetur quidem distinctio.
Sr. Bryan Duarte,3J%RzQjw(&,Voluptas eum sunt in architecto id assumenda.
Nathan Machado,q$A8U46PNu,Rerum aperiam cum molestiae nihil.
Gabriela Cassiano,#a8MJjh7_m,Esse iure eum consectetur perferendis iure.
Lívia Sousa,gb9AnwT((e,Occaecati magnam necessitatibus voluptates.
Pedro Nascimento,qa16S*tqA&,Dicta ratione quos quo maxime amet.
Arthur Gabriel da Cunha,l7KzEz1I#%,Eligendi sed maxime illo.
Ana Julia Freitas,B343THg(*Q,Voluptatibus nihil autem.
Leonardo Teixeira,)@2eX*E6bv,Pariatur tempore doloribus.
João Felipe Sales,*(04BTpxUM,Atque placeat suscipit illum quis dicta libero.
Theo Mendes,T2PMckQ+)Q,Fuga tempora totam tenetur praesentium quod rem.
Lucca Cirino,Q5O!2GaAcw,Corporis pariatur explicabo porro.
Breno da Paz,7L2^mMLud#,Animi labore autem laudantium nihil.
Melissa Ferreira,%f27ZLpNEj,Expedita cumque excepturi accusamus quae.
Aylla Brito,*KTZI#j7C4,Delectus laboriosam accusamus.
Caio Porto,(QChqFD&M2,Officia at hic odio harum voluptatibus.
Sra. Maria Sophia Guerra,*3LoZ*q98K,Vero fugiat officia molestias.
Sara Lima,$6Dy2fNalb,Debitis sit commodi natus voluptatum.
Thales Vasconcelos,8&%45A3pIi,Ea cupiditate itaque aut.
Antony Cardoso,@2GzAVuSgG,Sint harum aspernatur quisquam.
Alexia Souza,(g2NH0Ie5v,Veniam beatae cumque itaque aut officiis illo.
Rebeca Mendonça,)c)oXIlu22,Modi cum eius quo.
Melina Brito,c@3(OEf%hF,Error repellat omnis nesciunt corporis.
Dr. Cauã Casa Grande,WG2Ivdpvf%,Quos incidunt ut labore.
Dra. Isabel Vasconcelos,7(6T%s&S)C,Dolorum mollitia ipsam maxime.
Noah Pacheco,jtKIaPzl&6,Quo magni sequi deleniti.
Dr. Lucas Gabriel Macedo,T1ozqD^2+e,Ab soluta dolor commodi fugiat.
Marina Novais,LA!7PSCxKU,Vel qui eligendi veritatis tempore.
Dra. Raquel Lopes,%52%!&YdEF,Asperiores qui at sunt saepe a.
Dr. Benicio Ramos,_^BJ66Ts#6,Dolores quia autem facere ullam mollitia harum.
Dr. Marcelo da Paz,5v0MAT!j*),Necessitatibus itaque sint ut corporis.
Maria Luiza Moraes,@y3vAaEt#6,Enim aliquam tenetur molestias beatae.
Stephany Siqueira,#oh&ykQ42d,Eveniet quos nam iure.
Dra. Mariane da Mata,J#Y!5NyBrR,Qui iusto iure totam inventore suscipit fuga.
João Guilherme Silveira,3)L8W0X#3k,Aliquid cupiditate earum voluptatum.
Sra. Laura Nogueira,&hi6S@ulXp,Odio nesciunt assumenda aperiam aspernatur dicta.
Luiz Miguel Mendes,0&QooRLB!d,Distinctio voluptatibus consequuntur maxime.
Lara da Cruz,A0h@JwUh!7,Facilis numquam exercitationem placeat earum.
Srta. Maysa da Conceição,)7BymH+wA5,Impedit est expedita doloribus illo unde non.
Dr. Juan Almeida,sIypCN_c+2,Consequuntur aperiam rem qui perferendis est.
Camila Nunes,ZrkK0TfO+L,Saepe omnis quam.
Diego Mendes,$ZmX+WRm3Q,Nihil ea dignissimos sapiente.
Pietro Rezende,Zg__AnII$8,Doloribus unde rerum officia.
Benjamim Rezende,*PtD(@xY02,Harum atque rerum.
Dr. Raul Silva,2cQ!vz_e+#,Ad neque odio sapiente praesentium maxime.
Noah Castro,*f2F8emp*G,Dicta ratione minus ex.
Pietro Pastor,5c52YKd*N*,Explicabo est corporis ducimus.
Arthur Jesus,^U6irSkfQa,Harum saepe officiis excepturi.
Sra. Clara Abreu,e1@3Ib5_8I,Nulla nobis aut ipsa veniam.
Ravy Melo,BPD459#w*$,Occaecati porro architecto perspiciatis.
Gael Mendonça,s9Krl(mi!R,Soluta ipsum quam iusto. Saepe quod odio.
Dr. Pedro Henrique Guerra,lr6rh(Bw^_,Nihil iste assumenda id temporibus.
Dr. Ravy da Costa,O*XoKiuc_6,Quos numquam delectus sapiente.
Laura Gonçalves,@v7WQt%y+g,Ab dicta fuga quisquam odio illum repudiandae.
Otto Pastor,&1@zUz+R9D,Amet sit delectus quibusdam.
Maria Vitória Costa,bL44YZqZW%,Atque repudiandae laborum dolorum repudiandae.
Apollo Novais,t$26FDqlb5,Iusto error corrupti modi quasi similique in.
Rebeca da Mota,q7oVSHqP#8,Dignissimos cum quas. Explicabo eum adipisci.
Nathan Siqueira,^^6KJ2c8V9,Neque quam quia aliquam.
Josué Leão,rDsOL*7f+9,Natus ea odio nesciunt.
Heloísa Cirino,*9G2aT$^pD,Delectus tempora voluptates nihil.
Dra. Maya Nunes,G3Xgxm@v*P,Exercitationem quibusdam fugit suscipit.
Alexia Araújo,+IY2foZflG,Numquam doloremque quis dignissimos alias.
Davi Lucas Guerra,4p^1uHsvL^,Earum quis neque quasi assumenda accusamus.
Luiz Otávio Pacheco,!ckf5Jc%5^,Maxime assumenda eligendi.
Gabriel Santos,A58nL_eg$G,Sapiente eveniet dolores quae ipsam delectus.
Catarina Jesus,x$p7Dtt1dA,Vero facere consectetur sequi ullam odit.
Theodoro Martins,jtiQlUz2_3,Eum nostrum consequatur vel repudiandae vel.
Anna Liz Moraes,_#Sxgk7Fd0,Optio laboriosam quo sed.
Daniel Souza,Pl7I1GfC_9,Accusantium aliquid dolorum deserunt id.
Pedro Henrique Ramos,Yl6$YxSn7@,Quo aspernatur quo culpa repellat.
